{
  "schemaVersion": "kaoyan-existing-article-1.0",
  "source": "rebuilt",
  "articleKey": "ky-en1-2025-r-t4",
  "year": 2025,
  "textNumber": 4,
  "title": "The Digital Dark Age: Preserving Intangible Historical Records",
  "chineseTitle": "数字时代历史文献的保存危机与图书馆员的坚守",
  "topic": "图书馆学与数字资产长期留存 / 实体文物与无形数字信息的生存对比、数字格式淘汰、历史记录断层危机与图书馆员的不可或缺",
  "topicDomain": null,
  "subTopic": null,
  "overview": "本文探讨了在数字化席卷一切的现代社会中，无形数字历史文献所面临的严峻保存危机。与古董店里历经数百年长存的实体文物（本身即是信息载体、直接传达信息且无需刻意保存）形成鲜明反差的是，原生数字信息若缺乏维护极易湮灭。图书馆员的无私奉献让手机随时随地可查阅资料，却导致用户产生图书馆不再重要的严重错觉，贬低了图书馆的崇高价值。文章以过时的 ZIP 软盘生动展现了格式淘汰导致内部数据彻底灭失的巨大风险与历史记录断代的深夜噩梦。文章最后总结指出，保存数字历史记录充满重重艰巨挑战，但图书馆员的默默坚守确保了人类数字记忆绝不会走向彻底湮灭。",
  "wordCount": null,
  "readingTimeEstimate": null,
  "difficultyRating": null,
  "sourcePublication": null,
  "paragraphCount": 5,
  "sentenceCount": 13,
  "vocabularyCount": 0,
  "phraseCount": 0,
  "questionCount": 5,
  "capsules": {},
  "rawFields": {},
  "provenance": {
    "sourceLayer": "rebuilt",
    "sourceFile": "rebuilt_data/single_texts/text_2025_t4.json",
    "year": 2025,
    "articleKey": "ky-en1-2025-r-t4",
    "extractedAt": "2026-09-18T23:13:00+0800",
    "contentHash": "sha256:59913dd322dde34731f42b6d9cc49d416d2e540c0293e36284987085c459c015"
  }
}