{
  "schemaVersion": "kaoyan-existing-article-1.0",
  "source": "production",
  "articleKey": "ky-en1-1999-r-t2",
  "year": 1999,
  "textNumber": 2,
  "title": "Reading Comprehension Text 2",
  "chineseTitle": "Text 2 真题精读与题型分析",
  "topic": "学术探索 / 社会热点 / 文化政治",
  "topicDomain": null,
  "subTopic": null,
  "overview": "本篇选自 1999 年全国硕士研究生招生考试英语(一)真题 Reading Comprehension Text 2，全面涵盖考研核心高频词汇、长难句剖析与经典命题逻辑。",
  "wordCount": null,
  "readingTimeEstimate": null,
  "difficultyRating": null,
  "sourcePublication": null,
  "paragraphCount": 3,
  "sentenceCount": 20,
  "vocabularyCount": 80,
  "phraseCount": 0,
  "questionCount": 4,
  "capsules": {},
  "rawFields": {},
  "provenance": {
    "sourceLayer": "production",
    "sourceFile": "题库/英语/data_1999.js",
    "year": 1999,
    "articleKey": "ky-en1-1999-r-t2",
    "extractedAt": "2026-09-18T23:13:00+0800",
    "contentHash": "sha256:b1b48836140e58e97dfb702b0e6e3f26fd04e6d5b05afeb37a812d2d6474245a"
  }
}