{
  "schemaVersion": "kaoyan-existing-article-1.0",
  "source": "rebuilt",
  "articleKey": "ky-en1-2025-r-t3",
  "year": 2025,
  "textNumber": 3,
  "title": "The Streaming Wars and the Billion-Dollar Digital Piracy Menace",
  "chineseTitle": "好莱坞流媒体转型阵痛与盗版流媒体黑产冲击",
  "topic": "流媒体商业与数字反盗版 / 传统制片厂流媒体亏损、盗版流媒体黑产年入20亿、全美损失300亿与反盗版长期拉锯战",
  "topicDomain": null,
  "subTopic": null,
  "overview": "本文深入揭露了全球流媒体时代下好莱坞传统巨头陷入巨额亏损与数字盗版黑产猖獗的残酷现实。正规流媒体平台（如 Disney+、Peacock）年亏数十亿美元，而零制作成本的非法盗播平台几秒内抓取片源，年狂揽20亿美元暴利，利润率逼近90%，使正规平台面临巨大的生存威胁。文章指出奈飞等合法平台早年曾协助遏制传统文件上传盗版，但如今新型盗版每年致使美国经济损失300亿美元并蒸发25万个就业岗位。电影协会（MPA）早先曾因硅谷不予配合导致立法流产，后成立跨国特遣队执法将北美盗版网站压缩至126家。分析师霍利警示未来损失将达1130亿美元，指出数字盗版在短期内绝不可能消退减少。",
  "wordCount": null,
  "readingTimeEstimate": null,
  "difficultyRating": null,
  "sourcePublication": null,
  "paragraphCount": 6,
  "sentenceCount": 11,
  "vocabularyCount": 0,
  "phraseCount": 0,
  "questionCount": 5,
  "capsules": {},
  "rawFields": {},
  "provenance": {
    "sourceLayer": "rebuilt",
    "sourceFile": "rebuilt_data/single_texts/text_2025_t3.json",
    "year": 2025,
    "articleKey": "ky-en1-2025-r-t3",
    "extractedAt": "2026-09-18T23:13:00+0800",
    "contentHash": "sha256:8584e156584abce82ccc9fbfbc022a980fc2d99e647ce2532da72b531837c5fd"
  }
}