{
  "schemaVersion": "kaoyan-existing-article-1.0",
  "source": "rebuilt",
  "articleKey": "ky-en1-2019-r-t3",
  "year": 2019,
  "textNumber": 3,
  "title": "Frankenstein's Bicentennial and the Ethical Governance of AI",
  "chineseTitle": "《弗兰肯斯坦》诞生两百年与人工智能伦理规约",
  "topic": "科技伦理与哲学反思 / 人工智能伦理困境、自动驾驶电车难题与科技向善准则",
  "topicDomain": null,
  "subTopic": null,
  "overview": "本文以玛丽·雪莱发表《弗兰肯斯坦》两百周年为切入点，探讨了当今人工智能飞速发展所引发的深刻伦理拷问。尽管人类意识机制过于复杂以至于机器目前无法复制，但紧迫的现实伦理难题已近在眼前——如自动驾驶汽车在瞬时突发情境下的编程抉择仍超出现有能力。文章介绍了多国政府确立 AI 伦理准则的新动向，并对谷歌承诺不将 AI 用于武器和监控等伤害人类的表态给予了正面肯定，大声疾呼必须确保机器思维契合人类崇高价值，使其成为忠诚公仆而非失控反噬怪物。",
  "wordCount": null,
  "readingTimeEstimate": null,
  "difficultyRating": null,
  "sourcePublication": null,
  "paragraphCount": 6,
  "sentenceCount": 10,
  "vocabularyCount": 0,
  "phraseCount": 0,
  "questionCount": 5,
  "capsules": {},
  "rawFields": {},
  "provenance": {
    "sourceLayer": "rebuilt",
    "sourceFile": "rebuilt_data/single_texts/text_2019_t3.json",
    "year": 2019,
    "articleKey": "ky-en1-2019-r-t3",
    "extractedAt": "2026-09-18T23:13:00+0800",
    "contentHash": "sha256:28f4e51c89be9244743ddda418ed73df23e8d3888cfa59d2c6bbec9fce095f68"
  }
}