{
  "schemaVersion": "kaoyan-existing-article-1.0",
  "source": "production",
  "articleKey": "ky-en1-2024-r-t2",
  "year": 2024,
  "textNumber": 2,
  "title": "Alloparenting from Hunter-Gatherers: Towards Happier Families",
  "chineseTitle": "非洲狩猎采集部落“共同育儿”模式对现代家庭的启示",
  "topic": "演化人类学与家庭育儿 / 共同育儿（Alloparenting）、打破密集母职神话、跨代合作与构建更幸福家庭",
  "topicDomain": null,
  "subTopic": null,
  "overview": "本文探讨了从非洲狩猎采集部落借鉴“共同育儿”（alloparenting）传统经验以化解现代家庭育儿焦虑的演化人类学启示。在博茨瓦纳昆族和刚果部落中，每个孩子都由众多成年人共同分担照护，年长儿童也参与看护。专家指出，这种协作模式能显著减轻父母与孩子的焦虑，并可通过德国养老院配对幼儿园等创新方式融入西方社会。论文尖锐指出，西方现代核心家庭要求母亲独自育儿的“密集母职叙事”彻底背离了人类漫长的生物演化历史，导致母亲身心俱疲。对比英国托儿所1:4的严酷照护比，文章大声呼吁现代社会必须增加照料支持并借鉴部落混龄游戏与兄妹互助经验，以共同构建更加幸福美满的家庭生活。",
  "wordCount": null,
  "readingTimeEstimate": null,
  "difficultyRating": null,
  "sourcePublication": null,
  "paragraphCount": 6,
  "sentenceCount": 12,
  "vocabularyCount": 73,
  "phraseCount": 0,
  "questionCount": 5,
  "capsules": {},
  "rawFields": {},
  "provenance": {
    "sourceLayer": "production",
    "sourceFile": "题库/英语/data_2024.js",
    "year": 2024,
    "articleKey": "ky-en1-2024-r-t2",
    "extractedAt": "2026-09-18T23:13:00+0800",
    "contentHash": "sha256:d8ec5e130b6c9a85bc1b8f4cab663d4c9bd16f06a5e972f56f21440bbe52db98"
  }
}