{
  "schemaVersion": "kaoyan-existing-article-1.0",
  "source": "production",
  "articleKey": "ky-en1-2019-r-t4",
  "year": 2019,
  "textNumber": 4,
  "title": "The Supreme Court Ruling on E-Commerce Sales Tax",
  "chineseTitle": "美国最高法院推翻电商跨州免税判例与公平市场竞争",
  "topic": "宪政税法与电子商务 / 实体存在规则（Physical Presence Rule）废除与电商全美征收销售税",
  "topicDomain": null,
  "subTopic": null,
  "overview": "本文客观报道并深入讨论了美国联邦最高法院推翻实行数十年的“实体存在规则”跨州免税旧判例的里程碑裁决。肯尼迪大法官指出旧规则脱离经济现实造成各州每年巨额税收流失并破坏了公平市场竞争。文章系统分析了该裁决带来的深远市场后果：各州财政迎来增收胜利，原本就在各州依法纳税的传统大型实体连锁巨头（如沃尔玛）赢得公平竞技环境；而中小型纯线上零售商则失去了以往的免税价格优势，并面临沉重的跨州合规成本。",
  "wordCount": null,
  "readingTimeEstimate": null,
  "difficultyRating": null,
  "sourcePublication": null,
  "paragraphCount": 7,
  "sentenceCount": 12,
  "vocabularyCount": 86,
  "phraseCount": 0,
  "questionCount": 5,
  "capsules": {},
  "rawFields": {},
  "provenance": {
    "sourceLayer": "production",
    "sourceFile": "题库/英语/data_2019.js",
    "year": 2019,
    "articleKey": "ky-en1-2019-r-t4",
    "extractedAt": "2026-09-18T23:13:00+0800",
    "contentHash": "sha256:6c252624c3c97bb22d9f661e9172862f4e684befad72483171a6f63fcbd25e3d"
  }
}